chunk_id,text,filename,metadata
7f8d58f9be5543c0952d60084f7eb160,"During the 2024 European Society for Medical Oncology (ESMO) Congress in Madrid, Spanish oncology researchers presented a series of groundbreaking updates on targeted and immunotherapy-based treatments. The centerpiece of the conference was AZD5478, a next-generation EGFR inhibitor developed by AstraZeneca, which demonstrated significant activity in non-small-cell lung cancer (NSCLC) patients harboring EGFR exon 20 insertions. The Phase II data showed an objective response rate of 56% and median progression-free survival (PFS) of 10.4 months, surpassing current standards of care.

Dr. Isabel Romero from Hospital Vall d’Hebron in Barcelona highlighted the importance of molecular profiling, noting that “precision oncology is no longer an aspiration—it is the standard.” The presentation emphasized the need for routine next-generation sequencing (NGS) to detect resistance mutations and guide therapy selection. Moreover, safety outcomes were favorable, with diarrhea and rash being the most frequent adverse events, consistent with other EGFR inhibitors.

This presentation marked a shift toward comprehensive mutation testing across all lung cancer patients in Spain, supported by new reimbursement policies from the Ministry of Health that incentivize genomic diagnostics in tertiary hospitals.",oncology_update_spain.txt,"{""filename"": ""oncology_update_spain.txt"", ""country"": ""Spain"", ""topic"": ""Oncology"", ""source_type"": ""Congress Summary"", ""page_number"": 1, ""title"": ""ESMO 2024: Advances in EGFR Inhibition"", ""keywords"": [""AZD5478"", ""EGFR"", ""NSCLC"", ""AstraZeneca"", ""ESMO""], ""main_investigator"": ""Dr. Isabel Romero"", ""institution"": ""Hospital Vall d’Hebron"", ""year"": 2024}"
c006dc492ec541b8bc9ee9aa9e634d30,"Another highlight came from the collaborative trial between Hospital 12 de Octubre (Madrid) and the Spanish Breast Cancer Group (GEICAM), focusing on combination therapies for triple-negative breast cancer (TNBC). The study evaluated pembrolizumab in combination with the antibody-drug conjugate sacituzumab govitecan in patients with metastatic disease who had received at least two prior lines of therapy. The combination achieved an overall response rate of 28% and disease control rate of 64%, with median overall survival extending to 13.2 months.

Researchers also discussed biomarker-driven insights, revealing that patients with PD-L1 expression ≥10% and BRCA1/2 mutations had significantly higher response rates. “These findings underscore the evolving role of immunotherapy even in traditionally hard-to-treat tumor types,” stated Dr. Laura Sánchez, co-investigator and immuno-oncologist at Hospital 12 de Octubre. Safety data indicated manageable toxicity, with neutropenia and diarrhea as the leading adverse events.

The symposium closed with a call for greater collaboration between molecular pathology laboratories and oncology units to accelerate patient stratification and trial enrollment.",oncology_update_spain.txt,"{""filename"": ""oncology_update_spain.txt"", ""country"": ""Spain"", ""topic"": ""Oncology"", ""source_type"": ""Congress Summary"", ""page_number"": 2, ""title"": ""Combination Therapies in Triple-Negative Breast Cancer"", ""keywords"": [""Pembrolizumab"", ""Sacituzumab Govitecan"", ""TNBC"", ""GEICAM"", ""Immunotherapy""], ""main_investigator"": ""Dr. Laura Sánchez"", ""institution"": ""Hospital 12 de Octubre"", ""year"": 2024}"
bbc171c93c5a47c1805d888489d75ea9,"The Spanish Oncology Network (RedOnco) announced the launch of ""OncoDataLink,"" a national digital infrastructure designed to integrate clinical, genomic, and radiomic data from over 30 cancer research centers across Spain. The initiative, supported by European funding, aims to harmonize datasets, enable AI-driven pattern recognition, and optimize clinical trial recruitment through federated learning models.

Dr. Romero emphasized that such integration will “transform how oncologists interpret data, allowing faster translation of molecular insights into bedside practice.” The network will also collaborate with AstraZeneca’s Real-World Evidence division to develop dashboards for continuous post-market surveillance of novel cancer therapeutics.

The Congress concluded that the next frontier in oncology will hinge not only on discovering new molecules but also on data harmonization and computational intelligence to uncover unseen relationships between drugs, genes, and patient outcomes.",oncology_update_spain.txt,"{""filename"": ""oncology_update_spain.txt"", ""country"": ""Spain"", ""topic"": ""Oncology"", ""source_type"": ""Congress Summary"", ""page_number"": 3, ""title"": ""The OncoDataLink Initiative"", ""keywords"": [""Data Integration"", ""OncoDataLink"", ""Genomics"", ""AI"", ""Real-World Evidence""], ""main_investigator"": ""Dr. Isabel Romero"", ""institution"": ""RedOnco Network"", ""year"": 2024}"
69c14a8b63da4cf3b18fabbd00cefb4f,"The CARDI-RED study, conducted by the Mayo Clinic in collaboration with the Cleveland Heart Center, explored lipid-lowering strategies for patients resistant or intolerant to statins. This multicenter, double-blind trial evaluated the efficacy of a fixed-dose combination of bempedoic acid and ezetimibe compared with placebo in 310 patients with LDL cholesterol (LDL-C) levels above 160 mg/dL despite lifestyle modification and previous statin therapy.

After 24 weeks, patients receiving the combination therapy demonstrated a mean LDL-C reduction of 34% relative to baseline, compared with a 5% reduction in the placebo arm (p<0.001). Importantly, no significant increase in muscle-related adverse events, commonly associated with statins, was observed. High-sensitivity C-reactive protein (hs-CRP) levels also decreased by 23%, indicating an anti-inflammatory benefit beyond lipid lowering.

“These findings could redefine the standard of care for patients who cannot tolerate statins,” commented Dr. Michael Nguyen, principal investigator of the trial. “Our data show that bempedoic acid provides a safe, oral alternative for long-term cardiovascular risk management.”",cardio_study_usa.txt,"{""filename"": ""cardio_study_usa.txt"", ""country"": ""USA"", ""topic"": ""Cardiology"", ""source_type"": ""Publication Abstracts"", ""page_number"": 1, ""title"": ""CARDI-RED: Non-Statin LDL Reduction Strategies"", ""keywords"": [""Bempedoic Acid"", ""Ezetimibe"", ""LDL"", ""Mayo Clinic"", ""Cleveland Heart Center""], ""main_investigator"": ""Dr. Michael Nguyen"", ""institution"": ""Mayo Clinic"", ""year"": 2024}"
a6a430bdc7764d3185888aa4beb3d026,"A genomic substudy within CARDI-RED identified a subgroup of 62 patients carrying PCSK9 gene variants who exhibited even greater LDL-C reduction, averaging 42%. This observation suggests a potential gene-drug interaction, reinforcing the growing relevance of pharmacogenomics in cardiovascular prevention.

The study team recommended that future guidelines include genotyping for PCSK9 and SLCO1B1 polymorphisms to personalize therapy. The authors also noted that combining bempedoic acid with PCSK9 monoclonal antibodies could yield additive effects, paving the way for combination strategies in refractory hypercholesterolemia.

The research consortium plans to extend the study to evaluate long-term outcomes such as myocardial infarction rates and cardiovascular mortality. The U.S. Food and Drug Administration (FDA) has expressed interest in reviewing these findings as part of its ongoing assessment of non-statin lipid-lowering therapies.",cardio_study_usa.txt,"{""filename"": ""cardio_study_usa.txt"", ""country"": ""USA"", ""topic"": ""Cardiology"", ""source_type"": ""Publication Abstracts"", ""page_number"": 2, ""title"": ""Pharmacogenomic Insights and Future Directions"", ""keywords"": [""PCSK9"", ""Genotyping"", ""Pharmacogenomics"", ""FDA"", ""Cardiovascular Risk""], ""main_investigator"": ""Dr. Michael Nguyen"", ""institution"": ""Mayo Clinic"", ""year"": 2024}"
2b501bb8caf74fb9ab814f8af9530576,"A genomic substudy within CARDI-RED identified a subgroup of 62 patients carrying PCSK9 gene variants who exhibited even greater LDL-C reduction, averaging 42%. This observation suggests a potential gene-drug interaction, reinforcing the growing relevance of pharmacogenomics in cardiovascular prevention.

The study team recommended that future guidelines include genotyping for PCSK9 and SLCO1B1 polymorphisms to personalize therapy. The authors also noted that combining bempedoic acid with PCSK9 monoclonal antibodies could yield additive effects, paving the way for combination strategies in refractory hypercholesterolemia.

The research consortium plans to extend the study to evaluate long-term outcomes such as myocardial infarction rates and cardiovascular mortality. The U.S. Food and Drug Administration (FDA) has expressed interest in reviewing these findings as part of its ongoing assessment of non-statin lipid-lowering therapies.",cardio_study_usa.txt,"{""filename"": ""cardio_study_usa.txt"", ""country"": ""USA"", ""topic"": ""Cardiology"", ""source_type"": ""Publication Abstracts""}"
c80f7c811e8d485e832a445f6199f967,"The IL-6 Inhibition Trial (UK-IL6-2024) was a randomized, double-blind, placebo-controlled Phase II study evaluating the efficacy and safety of the monoclonal antibody Liximab in patients with moderate to severe rheumatoid arthritis. The trial, coordinated by the University of Oxford and conducted across five UK centers (London, Manchester, Edinburgh, Bristol, and Leeds), enrolled 240 adults aged between 35 and 70 years. Participants had an inadequate response to methotrexate and were randomized 2:1 to receive either Liximab or placebo, both administered via subcutaneous injection every two weeks.

After 12 weeks of treatment, patients in the Liximab group demonstrated a statistically significant improvement in the American College of Rheumatology 50 (ACR50) response rate, reaching 62% compared with 28% in the placebo group. Reductions in C-reactive protein (CRP) and erythrocyte sedimentation rate (ESR) levels were observed as early as week 4. Adverse events were generally mild to moderate in intensity, with fatigue, nausea, and injection-site reactions being the most common. Two cases of transient liver enzyme elevation were reported, both resolving spontaneously without medical intervention.

The investigators emphasized that Liximab’s mechanism of action—targeting the IL-6 receptor—aligns with established pathways involved in chronic inflammation and joint destruction. No cases of serious infection were detected, and overall tolerability was consistent with the safety profile of existing IL-6 inhibitors.",trial_inflammation_uk.txt,"{""filename"": ""trial_inflammation_uk.txt"", ""country"": ""United Kingdom"", ""topic"": ""Inflammatory Diseases"", ""source_type"": ""Clinical Trial Report"", ""page_number"": 1, ""title"": ""IL-6 Inhibition Trial – Phase II Study"", ""keywords"": [""Liximab"", ""IL-6"", ""Rheumatoid Arthritis"", ""Inflammation"", ""Oxford""], ""main_investigator"": ""Dr. Amelia Wright"", ""institution"": ""University of Oxford"", ""year"": 2024}"
cda3cfe5ae894b11bcbad195cee4a221,"A post-hoc biomarker analysis performed by the Oxford Rheumatology Research Group revealed that treatment with Liximab significantly reduced circulating levels of interleukin-6 (IL-6) and tumor necrosis factor-alpha (TNF-α), confirming effective pathway inhibition. The reduction in serum amyloid A and fibrinogen concentrations further supported a systemic anti-inflammatory effect. Imaging data from ultrasound scans showed a marked reduction in synovial vascularity after 8 weeks of therapy.

The study was led by Dr. Amelia Wright, principal investigator and senior lecturer at the University of Oxford. Collaborators included the National Rheumatoid Arthritis Society and funding support from AstraZeneca’s Early Immunology program. Dr. Wright stated that “Liximab demonstrates a compelling efficacy signal, suggesting potential disease modification when used early in the course of rheumatoid arthritis.”

A follow-up Phase III trial is being designed to assess long-term safety, radiographic progression, and comparative efficacy against Tocilizumab and Adalimumab. Discussions with the UK Medicines and Healthcare Regulatory Agency (MHRA) are ongoing to define optimal endpoints and patient stratification criteria.",trial_inflammation_uk.txt,"{""filename"": ""trial_inflammation_uk.txt"", ""country"": ""United Kingdom"", ""topic"": ""Inflammatory Diseases"", ""source_type"": ""Clinical Trial Report"", ""page_number"": 2, ""title"": ""Biomarker Analysis and Future Directions"", ""keywords"": [""Biomarkers"", ""IL-6"", ""TNF-alpha"", ""AstraZeneca"", ""UK-MHRA""], ""main_investigator"": ""Dr. Amelia Wright"", ""institution"": ""University of Oxford"", ""year"": 2024}"
